{
  "gameConfigId": "scoped_costs_v1",
  "maxLevel": 10,
  "stats": ["strength", "hp"],
  "slots": ["right_hand", "off_hand"],
  "classes": {
    "warrior": {
      "baseStats": { "strength": 5, "hp": 20 }
    }
  },
  "gearDefs": {
    "sword_basic": {
      "baseStats": { "strength": 3 },
      "equipPatterns": [["right_hand"]]
    }
  },
  "sets": {},
  "algorithms": {
    "growth": { "algorithmId": "flat", "params": {} },
    "levelCostCharacter": {
      "algorithmId": "mixed_linear_cost",
      "params": {
        "costs": [
          { "scope": "character", "resourceId": "xp", "base": 100, "perLevel": 50 },
          { "scope": "player", "resourceId": "gold", "base": 10, "perLevel": 5 }
        ]
      }
    },
    "levelCostGear": {
      "algorithmId": "linear_cost",
      "params": { "resourceId": "player.gold", "base": 50, "perLevel": 25 }
    }
  }
}
